{
  "$schema": "../../schemas/report-bundle.schema.json",
  "v": 1,
  "kind": "ai-ugc",
  "createdAt": "2026-05-04T13:10:00.000Z",
  "reporter": {
    "peerId": "peer:a1b2c3d4e5f6"
  },
  "subject": {
    "peerId": "peer:9z8y7x6w5v4u",
    "reasonCode": "unsafe-ai-content",
    "freeText": "generated faction unit portrait depicts disallowed imagery"
  },
  "evidence": {
    "scenarioId": "scenario:emberwild-1v1",
    "rulesetHash": "sha256:0f1e2d3c4b5a6978",
    "sessionStartedAt": "2026-05-04T12:00:00.000Z",
    "saveHash": "0123456789abcdef0123456789abcdef0123456789abcdef0123456789abcdef"
  },
  "deviceCapture": {}
}
